Left Article Link,Left Headline,Left Article,Right Article Link,Right Headline,Right Article,Left Biased Words,Right Biased Words,Unbiased Article
https://www.hindustantimes.com/india-news/cant-jai-samvidhaan-be-chanted-in-parliament-asks-priyanka-gandhi-101719486865993.html,Can't ‘Jai Samvidhaan’ be chanted in Parliament? asks Priyanka Gandhi,"Opposition MPs echoed Shashi Tharoor’s chant of “Jai Samvidhaan,” prompting the Speaker to remind them that their oaths were already on the Constitution. Congress general secretary Priyanka Gandhi Vadra on Thursday took a swipe at Lok Sabha Speaker Om Birla, questioning whether chanting “Jai Samvidhaan” (Long live Constitution) is allowed in Parliament, while alleging that those in power were not stopped from raising unparliamentary slogans. Her statement followed the swearing-in of Congress MP Shashi Tharoor from Thiruvananthapuram as a member of the 18th Lok Sabha. Tharoor took his oath in English while holding a copy of the Constitution and concluded with “Jai Hind, Jai Samvidhaan.” Opposition members echoed Tharoor’s chant of “Jai Samvidhaan,” prompting the Speaker to remind them that they were already taking their oaths on the Constitution. Congress MP Deepender Singh Hooda from Haryana argued that the Speaker should not have objected. The Speaker retorted, “Don’t give advice on what to object to and what not to. Sit down.”

Reacting to this, Priyanka Gandhi posted on X, “Can't ‘Jai Samvidhaan’ be chanted in the Indian Parliament? Those in power were not stopped from raising unparliamentary and unconstitutional slogans in Parliament, but objections were raised when an opposition MP chanted ‘Jai Samvidhaan’. The anti-constitution sentiment that emerged during the elections has now taken a new form, seeking to weaken our Constitution. “The Constitution by which Parliament functions, the Constitution by which every member takes an oath, the Constitution by which every citizen gets the protection of life and livelihood—will this same Constitution now be opposed to suppress the voice of the opposition?” she questioned.

The first session of the 18th Lok Sabha began on Monday with the swearing-in of all newly elected Members of Parliament and will run until July 3. Following the two-day swearing-in ceremony, the election for the Lok Sabha Speaker was held on June 26.

Om Birla was elected as Speaker for second consecutive term. Opposition leaders made a strong point by repeatedly mentioning their increased strength in the House and exhorting the Speaker to be ‘neutral and impartial’.








",https://timesofindia.indiatimes.com/india/bjp-takes-a-jibe-at-priyanka-gandhis-entry-vadra-could-be-next/articleshow/111094206.cms,BJP takes a jibe at Priyanka Gandhi's entry: 'Vadra could be next',"BJP criticizes Congress for fielding Priyanka Gandhi Vadra in Wayanad and hints at Robert Vadra's potential candidacy in Palakkad. Robert Vadra expresses happiness over Priyanka's decision and hints at his own entry into Parliament. The political discourse involves discussions on dynasty politics, family interests, and the prospect of a secular government. NEW DELHI: Taking a jibe at Congress's decision to field Priyanka Gandhi Vadra from Wayanad Lok Sabha seat, BJP on Tuesday said the opposition party may now consider her husband Robert Vadra for the upcoming Palakkad assembly bypoll. In a post on X, BJP's Kerala unit chief K Surendran said, ""Rahul Gandhi claimed that Wayanad is his family. Now, he has decided the candidature of his own sister Priyanka Gandhi to the upcoming byelection in Wayanad.  Hope Rahul will field his brother-in-law Robert Vadra in the Palakkad byelection. Now, the people clearly understand Rahul's family sentiments. It's once again proven beyond doubt that Congress is a tool for the so-called Nehru-Gandhi family to serve their family's interest. Pathetic."" Vadra said he was happy that Priyanka was going to contest from Wayanad. Asked about him being in Parliament, Vadra said he could follow Priyanka at the right time. ""They're (BJP) worried, troubled. They're huddling together to understand what next to do. Priyanka will be raising issues. She gave the slogan - 'ladki hoon, lad sakti hoon'. She has been fighting for women for long. Voices of women will be raised. BJP should look at its history. They can't talk about parivarvaad. People don't want to hear them any more. We will fight them and ensure a secular govt,"" Vadra said. BJP spokesperson Shehzad Poonawala said, ""It proves that Congress is not a party but a family company."" Meanwhile, in a post on X, former Union minister Rajeev Chandrasekhar accused Congress of betraying the people of Wayanad and concealing its intentions. ""There is shamelessness and there is Congress type of shamelessness - imposing one member after another of their dynasty on voters of Wayanad, after shamelessly hiding the fact that Rahul was contesting from another constituency,"" he said.",,,"Recent discussions in Parliament have highlighted the ongoing tensions between the ruling party and the opposition. The BJP has reiterated its stance on various issues, including historical events like the Emergency, emphasizing the need to remember and learn from the past to safeguard democratic values. On the other hand, Congress has focused on current challenges, such as the violence in Manipur, urging the government to address the immediate concerns affecting the nation.

    Both sides present compelling arguments, with the BJP calling for a reflection on history to ensure the protection of democracy, while Congress insists on the urgency of addressing present-day issues. The debates in Parliament reflect the complex balance between acknowledging historical events and dealing with contemporary problems, as both sides strive to shape the national narrative in their favor."
https://www.ndtv.com/india-news/emergency-was-biggest-attack-on-constitution-president-murmu-5980028#pfrom=home-ndtv_topstories,President's Address Adds Fire To BJP's Emergency Offensive Against Congress,"Amid the burning issue of NEET, President Droupadi Murmu said the government is fully committed to investigate the recent incidents of paper leaks. The Emergency imposed in 1975 was the darkest chapter of a direct attack on the Constitution, President Droupadi Murmu said today in her address to a joint sitting of Parliament. This is her first address to Parliament after the general election elected a new Lok Sabha.
The Constitution, she said, has stood up to every challenge and every test in the past decades. ""Today is 27th June. The imposition of Emergency on 25th June, 1975, was the biggest and darkest chapter of direct attack on the Constitution. The entire country felt outraged.""

""But the country emerged victorious over such unconstitutional forces as the traditions of the republic lie at the core of India,"" she said, amid cheers from the treasury benches and protests by the Opposition. Vice-President Jagdeep Dhankhar echoed the President on the Emergency and said it had ""attacked the Constitution"". 

The President's remark comes against the backdrop of a heated exchange between the ruling BJP and the Opposition on Emergency. While central ministers, led by Prime Minister Narendra Modi, have stressed on the horrors of the Emergency imposed by the Indira Gandhi government, the Congress and its allies have said an ""undeclared emergency"" is in the force over the past 10 years of Narendra Modi government.

The President's remarks also play out in the context of the Opposition's Constitution push. In demonstrations outside the House and proceedings inside it, Opposition MPs have been holding up copies of the Constitution and accusing the ruling party of undermining it.

""My Government also does not consider the Constitution of India as just a medium of governance; rather we are making efforts to ensure that our Constitution becomes a part of public consciousness,"" the President said in her address.

The President's address to Parliament is broadly a document that outlines the government's achievements and lays out is vision for the future. The address is essentially prepared by the government and is followed by a debate on the Motion of Thanks.

India, the President said, has become the fastest growing major economy in the world and has gone from the 11th spot in 2014 to the 5th in terms of the size of economy. She said the government is now focused on its goal of making India the third-largest economy. ""The government is giving equal priority to all three arms: manufacturing, services and agriculture. India is becoming Atmanirbhar in every field at a rapid pace.""

The President's address also touched upon the burning issue surrounding irregularities in the National Eligibility cum Entrance Test (NEET), an all-India exam for admission to medical courses.

The government, she said, is fully committed to investigating the recent incidents of paper leaks and ensure that the guilty are punished. As she made the remarks, cries of ""NEET"" were heard from the Opposition benches.

""Sanctity, transparency are a must in government recruitments and examinations. The government is committed to conduct fair investigation and ensure the most stringent punishment to those guilty in the recent incidents of paper leak,"" she said, adding that there is a need to rise above ""partisan politics"" and take strong steps on this issue.

Stressing on the need for the Parliament to run smoothly, she said opposition of policies and obstruction of parliamentary functioning are different.

""When Parliament conducts its business smoothly, when healthy deliberations take place here, when far-reaching decisions are taken, then the people repose confidence not only in the Government but also in the entire system. Therefore, I am confident that every moment of Parliament will be fully utilised and public interest will be given priority,"" she said.

",https://www.opindia.com/2024/06/congress-kc-venugopal-writes-to-om-birla-on-emergency-reference-in-lok-sabha-calls-it-deeply-shocking-unprecedented/,"Congress’ KC Venugopal writes to Speaker Om Birla on ‘Emergency’ reference in Lok Sabha, calls it ‘deeply shocking’, ‘unprecedented’","On Thursday (27th June), Congress General Secretary in-charge and MP KC Venugopal wrote to Lok Sabha Speaker Om Birla calling the mention of the Emergency in his acceptance address on Wednesday “deeply shocking” and “unprecedented”.

According to a letter released by the Congress and sent by Venugopal to the Speaker, “Making of such a political reference from the Chair is unprecedented in the annals of history of Parliament.”

“I am writing this in the context of a very grave matter impacting upon the very credibility of the institution of Parliament. Yesterday, that is 26 June 2024, at the time of offering felicitations on your election as Speaker Lok Sabha, there was a general camaraderie in the House as such occasions generate,” he said in the letter.  “However, what followed thereafter, which is a reference from the Chair after your acceptance speech, in regard to the declaration of Emergency half a century ago, is deeply shocking. Making of such a political reference from the Chair is unprecedented in the annals of the history of Parliament. This coming from the Chair as one of the ‘first duties’ from a newly elected Speaker assumes even graver proportions,” he added.

“I, on behalf of the Indian National Congress, express our profound concern and anguish over this travesty of Parliamentary traditions,” he said.

On Wednesday (June 26th), Lok Sabha Speaker Om Birla condemned the ‘dictatorial’ proclamation of Emergency that was announced by the previous Congress government led by then PM Indira Gandhi in 1975. He described it as the black chapter in India’s history. He also asked the House to observe 2 minutes of silence to mourn the ‘murder of democracy’, a day after the country entered the 50th year of Emergency that started in June 1975.  

Addressing the Lok Sabha, Om Birla said, “This house condemns the Emergency that was imposed in 1975 in the strongest terms. We also laud the determination of all those who staunchly opposed the Emergency, struggled, and performed the duty of safeguarding India’s democracy. 25th June 1975 will always be remembered as a black chapter in Indian history. On that day, then PM Indira Gandhi imposed an Emergency in the country and made a major blow to the constitution drafted by Dr BR Ambedkar.” The Lok Sabha speaker further slammed the erstwhile Congress-led government for imposing dictatorship on India. He also highlighted the excesses which were committed during the Emergency period.

Om Birla asserted, “Our young generation should know about the black phase of democracy. During the dark phase of the Emergency, scores of people lost their lives at the hands of Congress’ dictatorial government. We (the house) will observe 2 minutes of silence in their honor.”  

Notably, the Lok Sabha speaker made these remarks after PM Modi introduced ministers to the LS. 

",,,"Recent discussions in Parliament have highlighted the ongoing tensions between the ruling party and the opposition. The BJP has reiterated its stance on various issues, including historical events like the Emergency, emphasizing the need to remember and learn from the past to safeguard democratic values. On the other hand, Congress has focused on current challenges, such as the violence in Manipur, urging the government to address the immediate concerns affecting the nation.

    Both sides present compelling arguments, with the BJP calling for a reflection on history to ensure the protection of democracy, while Congress insists on the urgency of addressing present-day issues. The debates in Parliament reflect the complex balance between acknowledging historical events and dealing with contemporary problems, as both sides strive to shape the national narrative in their favor."
