Left Article Link,Left Headline,Left Article,Right Article Link,Right Headline,Right Article,Left Biased Words,Right Biased Words,Unbiased Article
https://thewire.in/environment/delhi-rains-six-injured-as-roof-collapses-at-airport-roads-waterlogged-across-city,"Delhi Rains: One Dead, Several Injured as Roof Collapses at Airport Terminal 1","Terminal 1 was expanded recently and Prime Minister Narendra Modi inaugurated the expanded version on March 11 this year – allegedly before the work was complete.

Delhi Rains: One Dead, Several Injured as Roof Collapses at Airport Terminal 1

New Delhi: A roof at Terminal-1D of the Indira Gandhi International Airport collapsed early on Friday morning, killing at least one person – a taxi driver – and injuring several others. Check-in counters at the airport were closed because of safety concerns. There were massive traffic jams around the airport area, and all departing flights until 1 pm have been cancelled.

A roof sheet and some supporting pillars fell on cars and taxis lining up outside the departures lane.

The Fire Service received a call about the collapsed roof at around 5:30 am. Civil aviation minister Ram Mohan Naidu has said he is personally monitoring the situation.


Terminal 1 was expanded recently and Prime Minister Narendra Modi inaugurated the expanded version on March 11 this year. Opposition leaders hit out at Modi for insisting on inaugurating the terminal during his campaign spree, while it was still “incomplete”.




Kinjarapu responded to “clarify that the building inaugurated by PM Narendra Modi is on the other side and the building that collapsed here is an old building and was opened in 2009″, thereby trying to distance Modi from the tragedy.

Heavy rains late on Thursday night and into Friday night has left Delhi’s streets waterlogged and several residential areas flooded on Friday (June 28) morning.


The traffic police issued advisories because of water-logging on roads and under flyovers.


This rain comes after a long and severe heat wave in the city, which had reportedly led to at least 277 people dying in heat-related incident.

The Indian Meteorological Department said that the Safdarjung area in the city received 154 mm rainfall between 8:30 am on Thursday and 5:30 am on Friday. The IMD also told people to “avoid waterlogged areas” and be careful of slippery roads.

",https://www.opindia.com/2024/06/delhi-airport-roof-collapse-terminal-one-inaurguration-congress-lies-exposed-fact-check/,"Congress politicises tragedy at Delhi airport, lies about PM Modi inaugurating the terminal area where the roof collapsed: Know the truth
","Back in February 2009, the then Delhi Chief Minister Sheila Dikshit inaugurated the terminal in question at the Indira Gandhi International Airport while Praful Patel was the Civil Aviation Minister.

On Friday (28th June), a roof collapsed at Terminal-1 of Delhi airport leaving one dead and six injured. Even in a situation like this, the opposition parties found an opportunity to attack the Central government.

Taking to X, Congress president Mallikarjun Kharge claimed that in March this year, Prime Minister Narendra Modi inaugurated the Terminal-1 of Delhi Airport the roof of which he asserted collapsed today.

“…On March 10th, when Modi ji inaugurated the Delhi Ariport T1, he called himself“Doosri mitti ka insaan…” All this false bravado and rhetoric was only reserved for quickly indulging in ribbon-cutting ceremonies before Elections! Our heartfelt condolences to the victims of the Delhi airport tragedy. They bore the brunt of a Corrupt, Inept and Selfish Govt,” Kharge wrote.


Congress leader Priyanka Gandhi Vadra was also quick to blame PM Modi as she wrote, “Delhi Airport Terminal-1, which was inaugurated by the Prime Minister in March, suffered a roof collapse today, resulting in the tragic death of a cab driver…This is BJP’s corrupt model of “take donation and give business” which has now been exposed. The question is, will the Chief Inauguration Minister take responsibility for this poor construction work and this corrupt model?”


Meanwhile, Trinamool Congress spokesperson Riju Dutta used the incident to attack PM Modi and claimed that PM Modi hurriedly inaugurated Terminal-1 of Delhi Airport for election campaigning. She alleged that PM Modi is “directly responsible” for the death of three people in the roof collapse.

“Roof collapse in Delhi Terminal 1 Airport departure area. 3 Dead including a cab driver in pillar collapse, at least 6 injuries. Tragedy & national shame. Flights suspended. For election campaigning, PM Modi had hurriedly “inaugurated” T1 in March even while it was under construction. From Jabalpur Airport to Ayodhya Station to now New Delhi Airport, “Photojeevi” PM’s desperation to inaugurate projects before completion for political mileage is the fundamental reason for such tragedies. He’s directly responsible for the death of 3 people who lost their lives because PM Modi was desperate to campaign,” Dutta posted.


Tamil Nadu Congress general secretary Laksmi Ramachandran claimed that the Delhi Airport is not an old one but rather “just inaugurated”. “OMG….Airport roof falling? It is not even an old airport, just inaugurated one! When will we wake up? This is what monopoly leads to….3 lives lost,” she posted.


Was Delhi Airport’s Terminal-1 inaugurated by PM Modi three months ago?
Amidst the political blame game started by the opposition parties, Civil Aviation Minister Ram Mohan Naidr said that the building that collapsed here is an old building and was inaugurated back in 2009.

“…we are taking this incident seriously…I want to clarify that the building inaugurated by PM Narendra Modi is on the other side and the building that collapsed here is an old building and was opened in 2009…” the Minister said.


Notably, back in February 2009, the then Delhi Chief Minister and Congress leader Sheila Dikshit inaugurated the terminal in question at the Indira Gandhi International Airport when Praful Patel was the Civil Aviation Minister.

",,,"Recent discussions in Parliament have highlighted the ongoing tensions between the ruling party and the opposition. The BJP has reiterated its stance on various issues, including historical events like the Emergency, emphasizing the need to remember and learn from the past to safeguard democratic values. On the other hand, Congress has focused on current challenges, such as the violence in Manipur, urging the government to address the immediate concerns affecting the nation.

    Both sides present compelling arguments, with the BJP calling for a reflection on history to ensure the protection of democracy, while Congress insists on the urgency of addressing present-day issues. The debates in Parliament reflect the complex balance between acknowledging historical events and dealing with contemporary problems, as both sides strive to shape the national narrative in their favor."
https://thewire.in/politics/modis-boast-about-giving-70-muslim-obc-groups-reservation-in-gujarat-as-cm-comes-back-to-haunt-him,Modi’s Boast About 'Giving 70 Muslim OBC Groups Reservation in Gujarat as CM' Comes Back to Haunt Him,"Three reasons why BJP’s shrill pitch against Muslim reservations is not only based on untruths but also hypocritical and not politically savvy.

Modi’s Boast About 'Giving 70 Muslim OBC Groups Reservation in Gujarat as CM' Comes Back to Haunt Him

“Among Muslims in Gujarat, there are 70 groups, who are OBC. When I was in Gujarat, they used to get benefits in the OBC category “

– Narendra Modi on February 9, 2022

Prime Minister Narendra Modi has been on a hate-speech spree since his outing in Rajasthan’s Banswada, first on “redistribution”, telling those assembled that their “mangalsutras” and few resources “hidden in bajra cans” will be taken away by the Congress and “redistributed” to “Musalmaan” or “those who have more children,” and who are “infiltrators”.


But subsequently, when a distinct impression gained momentum that the BJP wants “400 seats” to scrap reservations, the party has stopped using the slogan and also tried to cap its several leaders from saying they want to change the Constitution. Modi’s speeches too have taken to spreading a different kind of misinformation about the Congress manifesto. He and other top leaders of the BJP are officially saying that the Congress wants to “take away reservation from SC/ST/OBCs” and “give it to Muslims.”

But even this has political costs for the BJP, ruling with a majority for ten years now.

Any hopes that Modi and the BJP had with the talk of “Muslim outreach,” emphasised by the party, particularly focusing on ‘triple talaq’ as a means to dilute Muslim concerns to take away the edge from sections of the population that are determined to oppose the BJP, would have vanished after the spree of open Islamophobia.

But there are three aspects on which the reservation talk on Muslims is backfiring and embarrassing the BJP.

Firstly, Modi himself has been keen to take credit for providing reservation for backward Muslims. In an interview to ANI two years ago, he applauded himself forgiving them benefits. He had said: “Among Muslims in Gujarat, there are 70 groups, who are OBC. When I was in Gujarat, they used to get benefits in the OBC category.” (Watch the video at 28:40). All allegations against the Congress leadership nationally or in states like Karnataka and Andhra Pradesh and Telangana fall flat with Congress leaders pointing out to his own comments and claims about ensuring backward Muslims get their due via reservations.

Second, his own allies in the NDA, JD(S)’s H.D. Deve Gowda, were claiming credit for ensuring that Muslim backwards got the reservation benefits due to them when Gowda was chief minister of Karnataka, taking away from Modi trying to paint Karnataka’s Congress dispensation into a corner by portraying them as pro-Muslim and anti-Hindu. But Mysore, the princely state has been a pioneer in introducing reservation towards fair representation and social justice.

“The first ever order for affirmative action was issued in 1874 and it included Muslims.” This followed the first ever census conducted in India in 1872 which “revealed a preponderance of Brahmins in public services, to correct which the first order introducing reservation was introduced in 1874 in Mysore state, restricting it to only the Police Department.” In their present form, reservations for Muslim backwards are at least 20 years old.

When BJP’s Basavaraj Bommai was chief minister of the state, he scrapped the reservation benefits for backward Muslims, till he was ordered by the Supreme Court to reinstate the provision.

On April 25, 2023, Karnataka chief minister Bommai’s counsel told the Supreme Court that the state government will not implement its decision to scrap 4% reservation for Muslims in the 2B category of the ‘Other Backward Castes’ till the hearing in the top court is completed.

BJP’s ally in Andhra Pradesh and Telangana, Telugu Desam Party (TDP) president N. Chandrababu Naidu has promised to preserve the 4% reservations to Muslims under the OBC category in Andhra Pradesh, if the TDP-JSP-BJP alliance is elected to power. He did this as recently as on May 2 (Thursday), while addressing a Praja Galam public meeting. Naidu, reports The Hindu, said that advocates would be engaged to get the case resolved in the Supreme Court.

“Interests of the Muslims will be safeguarded by rejuvenating welfare schemes meant for them,” he said.

Third, all talk of ‘Pasmanda’ Muslims, which has been used to drive a wedge in the idea of a consolidated Muslim vote, was important in states like Bihar and particularly pushed there. Dainik Jagran even did an ‘inside story’ on November 23, 2022, on the planning by the BJP to cleave backward Muslim votes off from the Mahagathbandhan for itself. But, now, with this wholesale attack personally by Modi on the idea of reservation for Muslim backwards has further compounded alienation from the BJP. Their votes may not matter or be needed by the BJP, but their political actions do have consequences.

In India, reservations are given, flowing from Article 15(4) and 16(4) for backwardness irrespective of religion.

",https://www.opindia.com/2024/04/congress-trolls-spread-fake-news-about-modi-granting-reservation-to-muslim-castes-as-gujarat-cm-here-is-the-truth/,"Congress trolls spread fake news about Modi granting reservation to Muslim castes as Gujarat CM, here is the truth about OBC reservations in Gujarat under Modi’s tenure","Curiously, upon examining the castes enumerated in Gujarat's state OBC list, it becomes apparent that all the Muslim castes that were included in the list were before Narendra Modi assumed office as Chief Minister of Gujarat. Subsequently, during Modi's tenure as CM, 14 castes and some sects were appended to the list, none of which pertained to Muslims.
As the 2024 Lok Sabha elections are underway, the Congress trolls on social media are hyperactively spreading fake news and disinformation in the forlorn hope of tipping the scales in favour of their party, whose leaders appear resigned to the fact that Modi’s return to power is all but inevitable. 

In an attempt to reverse the fortunes of the Congress party, its online supporters and trolls have started claiming that Modi granted reservations to Muslim castes during his tenure as Gujarat CM. 

The claims have spawned on social media after PM Modi asserted that Congress tried to grant reservation to Muslims at the expense of SC/ST castes. Addressing the electorate in Rajasthan’s Tonk-Sawai Madhopur Lok Sabha constituency, slated to cast their votes on April 26, Prime Minister Narendra Modi remarked on Tuesday that in 2004, the Congress attempted to allocate reservations to Muslims in Andhra Pradesh at the expense of diminishing SC/ST reservations, displaying what he described as a disregard for the Constitution.

“The reality is that during the Congress regime, they sought to carve out a separate reservation for their favoured voting bloc by encroaching upon the reservations meant for Dalits and backward classes. This action, he emphasised, stands in stark contradiction to the principles outlined in the Constitution,” PM Modi said. 

No sooner did Modi accuse Congress of minority appeasement by granting reservations to Muslims by encroaching upon quota meant for SC/ST castes than a raft of Congress trolls online began sharing an incomplete video to insinuate that Modi accorded reservation to Muslim castes during his tenure as the Gujarat CM. 



Congress trolls share an incomplete video of Modi to make misleading claims: Modi doesn’t claim to extend reservations to Muslim castes in the state list
Firstly, in the video, Modi isn’t making such assertions; rather, he mentions that during his tenure as the Chief Minister of Gujarat, numerous Muslim castes benefited from reservations under the OBC quota. However, he notes that the media often overlooks such instances. Nowhere does Modi claim that his administration included any Muslim caste in the state’s OBC list.

It is indeed a fact that numerous “Muslim castes” have been receiving reservations under OBC quotas across various states for nearly four decades. Muslim castes were also granted reservations in the central OBC quota, with the UPA government issuing notifications to this effect. This practice predates Modi’s tenure as Chief Minister of Gujarat.

Curiously, upon examining the castes enumerated in Gujarat’s state OBC list, it becomes apparent that all the Muslim castes that were included in the list were before Narendra Modi assumed office as Chief Minister of Gujarat. Subsequently, during Modi’s tenure as CM, 14 castes and some sects were appended to the list, none of which pertained to Muslims.


Notifications issued by successive Gujarat govts to extend reservations to various caste groups
Modi took the oath of Gujarat CM on 7 October 2001 and was the chief minister of the state till 2014. As per the List of Socially and Educationally Backward Classes declared by Gujarat State, there were 7 instances when the state government intervened to add castes to the existing list.

These include Kamli, Tamboli, Garai, Gurav, Kalal (Hindu), Sanghar (Hindu), Nagarchi, Kayasth, Gandharv (Hindu), Darji, Bhandari, Kathi Rajgir and Ahir Gor, Kuruhin Shetty, and Hajari (Rajput). 


Castes included in reservations under Modi as Gujarat CM
Kalal Muslims were already included in caste reservations; Kalal Hindus were included in reservations under Modi as Gujarat’s CM
Indeed, a noteworthy instance arises with the Kalal caste of Gujarat. While both Hindus and Muslims are recognised as belonging to this caste, only Muslim Kalals were granted reservation and incorporated into the OBC list by the Gujarat government. It wasn’t until 2005, under the Modi administration, that Hindu Kalals were eventually included in the list.

Interestingly, there are 31 Muslim castes granted reservations by the Gujarat government. Out of 31, 29 Muslim castes were granted reservations under the Congress-led governments in the state. There were two instances when Muslim castes were included in the ambit of reservations under BJP-led governments, one in December 1995 and the other one in September 1996, but Modi was not at the helm of the government then. 


",,,"Recent discussions in Parliament have highlighted the ongoing tensions between the ruling party and the opposition. The BJP has reiterated its stance on various issues, including historical events like the Emergency, emphasizing the need to remember and learn from the past to safeguard democratic values. On the other hand, Congress has focused on current challenges, such as the violence in Manipur, urging the government to address the immediate concerns affecting the nation.

    Both sides present compelling arguments, with the BJP calling for a reflection on history to ensure the protection of democracy, while Congress insists on the urgency of addressing present-day issues. The debates in Parliament reflect the complex balance between acknowledging historical events and dealing with contemporary problems, as both sides strive to shape the national narrative in their favor."
