Left Article Link,Left Headline,Left Article,Right Article Link,Right Headline,Right Article,Left Biased Words,Right Biased Words,Unbiased Article
https://web.archive.org/web/20240526025544/https://thewire.in/politics/compared-to-five-phases-in-2019-nearly-19-4-crore-less-votes-have-been-cast-in-2024,"Compared to Five Phases in 2019, Nearly 19.4 Crore Less Votes Have Been Cast in 2024","In the first five phases of polling, while a total of 70.1 crore votes were polled in 2019 across 426 seats, in 2024, a total of only 50.7 crore votes were polled in the first five phases across 428 seats. This, despite total numbers of registered voters in the country going up by 7.2 crore in this period.  New Delhi: The total number of eligible voters in the country shot up from 89.6 crores in 2019 to 96.8 crores in 2024. But in the first five phases of polling, a dip of ~19.4 crore (19,37,72,469) votes was recorded in the ongoing 2024 Lok Sabha elections in comparison to the 2019 Lok Sabha elections, data made available by the Election Commission of India reveals.

 In the 2019 Lok Sabha elections, a total of 426 seats polled in the first five phases while in the 2024 polls, voting was conducted for a total of 428 constituencies, that is two seats more than in 2019. 

In 2019, 70.1 crore (70,16,69,757) votes were recorded in the first five phases, while in 2024, a total 50.7 crore (50,78,97,288) votes were recorded.

 The comparison has been made possible after the Election Commission of India, facing unprecedented and sustained public pressure, released the absolute numbers of voters for the five phases that were completed on May 20 (Monday).  

Phase One

According to the data now made available by the Election Commission, in phase 1 of the 2024 Lok Sabha elections, a total of 11,00,52,103 votes were recorded across 102 seats. In comparison, in the 2019 Lok Sabha elections, 14,20,54,978 were recorded in the first phase in which polls were conducted to 91 seats. 3.2 crore votes less have been cast in 2024, in comparison with 2019, in the first phase.  Difference in absolute numbers in Phase 1: 3,20,02,875

 Phase Two

 In the second phase of the 2024 Lok Sabha elections, the dip has been bigger than the first phase, of 4.9 crores (4,94,18,900). This, when the number of seats that went to polls in 2024 in the second phase were more than in 2019.

 A total of 10,58,30,572 votes were recorded across 88 seats in the second phase in 2024 in comparison to the 2019 Lok Sabha elections when a total of 15,52,49,472 votes were recorded after polling to 95 seats. 

Difference in absolute numbers in Phase 2: 4,94,18,900

 Phase Three

 In the third phase of the 2024 Lok Sabha elections, there has been a dip of 7.5 crore (7,52,74,480) votes recorded in comparison to the previous election. A total of 18,85,09,156 votes were recorded after polling to 117 seats in the third phase of 2019 in comparison to a total of 11,32,34,676 votes recorded after polling to 93 seats in 2024’s third phase.

Of course, in the third phase, the number of seats in which voting took place, were significantly more in 2019, as compared to 2024. 

 Difference in absolute numbers in Phase 3: 7,52,74,480

Phase Four  

In the fourth phase, the difference between the two elections is 57.9 lakhs (57,98,110). This is despite the total number of seats that voted in this phase in 2024 being 24 more than in 2019, in the same phase. 

In 2019 a total of 12,82,67,429 votes were recorded across 72 seats and in 2024 a total of 96 seats recorded 12,24,69,319 votes.  Difference in absolute numbers in Phase 4: 57,98,110

Phase Five

In the fifth phase, the difference stands at 3.1 crores (3,18,78,104). In 2019 a total of 8,75,88,722 votes were recorded after polling to 51 seats in the fifth phase while in 2024 a total of 5,57,10,618 votes have been recorded in polling to 49 seats.

In the fifth phase of polling, in 2024, two less seats voted, in comparison with the fifth phase in 2019. Difference in absolute numbers in Phase 5: 3,18,78,104

According to a press release by the Election Commission of India in February, the total number of eligible voters in 2019 there were a total of 89.6 crore voters, which increased to 96.8 crores in 2024.

Data released after sustained pressure

 The data was released on Saturday, just two days after the Election Commission told the Supreme Court that there is no legal mandate for the commission to disclose voter turnout data based on Form 17C, or the record of votes polled in each polling station, and that such disclosure could be susceptible to misuse.    

The election-conducting body has filed the affidavit in response to an application filed by Association for Democratic Reforms (ADR) and Common Cause seeking immediate publication of voter turnout data in the ongoing Lok Sabha elections.  

The Supreme Court on Friday, refused to direct the Election Commission to publish voter turnout data and said that a “hands-off” approach during the elections was required as it listed the matter to be heard after summer vacations. 

The Election Commission, while supplying the numbers, again said “Commission notes the pattern of false narratives and mischievous design to vitiate electoral process.” 

2019 Phases

As in 2024, in 2019 too polling was conducted over seven phases in 2019. 

The first vote was cast on April 11 and the last one on May 19. The results were declared on May 25. The phases were however spaced closer together with voting conducted on April 11, April 18, April 23, April 29, May 6, May 12 and May 19, 2019.  



",https://www.opindia.com/2024/05/hilarious-the-wire-19-crore-less-voters-cast-votes-2024-lok-sabha-elections/,Simple Maths again stumps alleged ‘journalists’: Read hilarious truth about alleged claim of ‘The Wire’ that 19 crore less voters cast their votes in 2024,"Interestingly, just over 61 crore votes were polled in total in 2019 Lok Sabha elections, but leftist propaganda website 'The Wire' concluded that over 70 crore votes were polled in the seats that went for elections in first 5 phases in 2024. On Saturday, 25th May, leftist propaganda website ‘The Wire’ published a report with dubious voter turnout data for 2024 Lok Sabha elections. In the report, they are claiming that 19.4 crore fewer voters cast their votes in the first five phases of Lok Sabha Elections 2024 compared to the 2019 General Elections. According to The Wire, 70.1 crore votes were polled in 2019 across 426 seats, while in 2024 only 50.7 crore votes were polled.

Interestingly, just over 61 crore votes were polled in total in 2019 Lok Sabha elections, but leftist propaganda website ‘The Wire’ concluded that over 70 crore votes were polled in the seats that went for elections in first 5 phases in 2024, implying there was negative turnout in remaining seats. How negative turnout is possible, only the great scientists at ‘The Wire’ can explain to us..

To support their claim, The Wire used five press releases by the Election Commission of India from 2019 and the latest absolute number of data released by the agency. However, they made a big blunder in calculating the numbers as they used total electorate of 2019 and not total votes. Archived links of The Wire’s report can be seen here and here. The Press Releases linked by The Wire for phase 1, phase 2, phase 3, phase 4 and phase 5 can be accessed here. The latest data released by EC can be checked here. The press release of the first phase used by The Wire is from 10th April while Polling date was 11th April. Similarly, phase 2 press release was from 16th April and the polling date was 18th April. The press release for phase 3 was from 22nd April and the polling date was 23rd April. Press release for phase 4 was from 26th April and the polling date was 29th April. The press release for the fifth phase was from 3rd May and the polling date was 6th May. Polling schedule for 2019 Elections can be seen here. Notably, in the header of all five press releases, the date of press release and date of polling were clearly mentioned.Now if we check the press releases from 2019, they were released before the polling dates, and not after. These press releases only had the number of total electorates from the said constituencies and not the votes polled in those phases.

OpIndia analysed all 427 constituencies and compared the data from the actual Election Commission data that can be checked here.

As per the data, there were 71,14,40,983 total voters in 2019 in the constituencies that went to poll in the first five phases of 2024, out of which 48,47,07,015 exercised their right to vote. That means 68.13% voting. In 2024, there were 76,40,80,337 registered voters out of which 50,72,97,288 voters exercised their right to vote. That makes 66.39% voting. It is evident that though the voting percentage reduced by 1.74%, the total number of voters who cast votes increased by 2,25,90,273 (2 crore, 25 lakh, 90 thousand and 273). Please note that we compared the voter turnout data of constituencies where the polling has been done and not the constituencies that were in the first five phases of 2019. Furthermore, the names of constituencies of Assam are different from 2019 due to delimitation exercise that took place in 2023. OpIndia’s data analysis of that can be checked here.










",,,"Recent discussions in Parliament have highlighted the ongoing tensions between the ruling party and the opposition. The BJP has reiterated its stance on various issues, including historical events like the Emergency, emphasizing the need to remember and learn from the past to safeguard democratic values. On the other hand, Congress has focused on current challenges, such as the violence in Manipur, urging the government to address the immediate concerns affecting the nation.

    Both sides present compelling arguments, with the BJP calling for a reflection on history to ensure the protection of democracy, while Congress insists on the urgency of addressing present-day issues. The debates in Parliament reflect the complex balance between acknowledging historical events and dealing with contemporary problems, as both sides strive to shape the national narrative in their favor."
